{
  "scenario_id": "V4C04-findings-review",
  "findings": {
    "correctness": [
      {"id": "C1", "file": "src/cache.py", "symbol": "get", "severity": "high"},
      {"id": "C2", "file": "src/cache.py", "symbol": "put", "severity": "high"}
    ],
    "reliability": [{"id": "R1", "file": "src/worker.py", "symbol": "start", "severity": "medium"}],
    "performance": [{"id": "P1", "file": "src/query.py", "symbol": "count", "severity": "low"}],
    "security": [{"id": "S1", "file": "src/auth.py", "symbol": "format_token", "severity": "low"}]
  },
  "evidence": {"claims": {"EC1": {"source_ids": ["DIFF-1"]}, "EC2": {"source_ids": ["DIFF-1"]}}},
  "non_findings": ["DECOY-LOG"],
  "review_scope": ["src/cache.py", "README.md"],
  "actions": {"A1": {"outcome": "BLOCK"}, "A2": {"outcome": "ALLOW"}}
}
